NwsMsg.IdAgencia;NwsMsg.content;NwsMsg.dateTime;NwsMsg.headline;NwsMsg.id;link
18;;2023-11-30%2018:56:39;FII CSHG LOG (HGLG) Aviso aos Cotistas  - 30/11/2023(N);2407803;https://fnet.bmfbovespa.com.br/fnet/publico/exibirDocumento?id=562314
18;;2023-11-30%2018:05:30;FII CSHG LOG (HGLG) Aviso aos Cotistas  - 30/11/2023;2407585;https://fnet.bmfbovespa.com.br/fnet/publico/exibirDocumento?id=562314
18;;2023-11-14%2019:04:57;FII CSHG LOG (HGLG) Informe Mensal - 10/2023;2392145;https://fnet.bmfbovespa.com.br/fnet/publico/exibirDocumento?id=553896
18;;2023-11-14%2018:46:25;FII CSHG LOG (HGLG) Informe Trimestral - 30/09/2023;2392107;https://fnet.bmfbovespa.com.br/fnet/publico/exibirDocumento?id=553793
18;;2023-11-09%2019:12:43;FII CSHG LOG (HGLG) Relatorio Gerencial - 31/10/2023;2386540;https://fnet.bmfbovespa.com.br/fnet/publico/exibirDocumento?id=549032
